{
  "schema": "pir/1.0",
  "gtin": "9351886002833",
  "sku": "BD425W",
  "brand": "Schmick",
  "range": "BD",
  "name": "1-Door Wine Fridge",
  "category": "wine_fridge",
  "status": {
    "brand_certified": false,
    "brand_domain": null,
    "certified_date": null,
    "submitted_by": "bar-fridges-australia.com.au",
    "submitted_date": "2026-03-05"
  },
  "facts": {
    "capacity_litres": 405,
    "dimensions_exterior_w_mm": 595,
    "dimensions_exterior_d_mm": 695,
    "dimensions_exterior_h_mm": 1800,
    "weight_kg": 129,
    "noise_db": 43,
    "power_consumption_kwh_per_24h": 1.24,
    "ambient_temperature_max_c": 38,
    "location": [
      "indoor"
    ],
    "lockable": true,
    "adjustable_feet": true,
    "adjustable_feet_count": 4,
    "door_hinge": "right",
    "led_lighting": true,
    "interior_finish": "Black Molded Plastic",
    "running_cost_aud_annual": 116.05,
    "running_cost_basis_cents_per_kwh": 25.64,
    "energy_star_rating_au": 10,
    "dimensions_interior_w_mm": 450,
    "dimensions_interior_d_mm": 540,
    "dimensions_interior_h_mm": 1600,
    "ventilation_top_mm": 40,
    "ventilation_each_side_mm": 40,
    "ventilation_rear_mm": 150,
    "approvals": [
      "EMC (C-Tick)",
      "SAA Electrical",
      "RCM"
    ],
    "refrigerant": "R600",
    "component_compressor": "Jiaxipera",
    "component_transformer": "Meanwell (Taiwan)",
    "component_fan_secondary": "Noctua (Silent)",
    "energy_star_rating_au_note": "Australian 1-10 star scale",
    "door_type": "glass",
    "door_reversible": true,
    "door_count": 1,
    "door_heated": false,
    "body_colour": "black",
    "led_light_colour": "white"
  },
  "qa": [
    {
      "q": "What is the capacity?",
      "a": "405 litres.",
      "facts": [
        "capacity_litres"
      ]
    },
    {
      "q": "Is it lockable?",
      "a": "Yes. Includes a key lock.",
      "facts": [
        "lockable"
      ]
    },
    {
      "q": "How noisy is it?",
      "a": "43 dB.",
      "facts": [
        "noise_db"
      ]
    },
    {
      "q": "What are the running costs?",
      "a": "Approximately $116.05 AUD per year based on 25.64 cents per kWh.",
      "facts": [
        "running_cost_aud_annual",
        "running_cost_basis_cents_per_kwh",
        "power_consumption_kwh_per_24h"
      ]
    },
    {
      "q": "What refrigerant does it use?",
      "a": "R600.",
      "facts": [
        "refrigerant"
      ]
    },
    {
      "q": "What is the energy star rating?",
      "a": "10 stars on the Australian 1-10 star scale.",
      "facts": [
        "energy_star_rating_au",
        "energy_star_rating_au_note"
      ]
    },
    {
      "q": "What approvals does it have?",
      "a": "EMC (C-Tick), SAA Electrical, RCM.",
      "facts": [
        "approvals"
      ]
    }
  ],
  "documents": [
    {
      "type": "brochure",
      "url": "https://brochures.barfridgesaustralia.au/174752036/8393486237988.pdf",
      "source": "bar-fridges-australia.com.au",
      "brand_certified": false
    }
  ],
  "sellers": [
    {
      "name": "Bar Fridges Australia",
      "domain": "bar-fridges-australia.com.au",
      "url": "https://bar-fridges-australia.com.au/products/schmick-upright-glass-door-wine-refrigerator-model-bd425w",
      "authorized": false,
      "regions": [
        "AU"
      ]
    }
  ]
}
