{
  "schema": "pir/1.0",
  "gtin": "9351886006107",
  "sku": "BC46W-VC",
  "brand": "Schmick",
  "range": "BC",
  "name": "1-Door Bar Fridge",
  "category": "bar_fridge",
  "status": {
    "brand_certified": false,
    "brand_domain": null,
    "certified_date": null,
    "submitted_by": "bar-fridges-australia.com.au",
    "submitted_date": "2026-03-05"
  },
  "facts": {
    "capacity_litres": 46,
    "capacity_375ml_cans": 38,
    "dimensions_exterior_w_mm": 430,
    "dimensions_exterior_d_mm": 470,
    "dimensions_exterior_h_mm": 500,
    "weight_kg": 16,
    "noise_db": 39,
    "power_consumption_kwh_per_24h": 0.21,
    "location": [
      "indoor"
    ],
    "lockable": true,
    "adjustable_feet": true,
    "adjustable_feet_count": 2,
    "door_hinge": "right",
    "led_lighting": true,
    "interior_finish": "White Molded Plastic",
    "door_reversible": true,
    "door_count": 1,
    "door_type": "glass",
    "door_heated": false,
    "body_colour": "branded",
    "led_light_colour": "white",
    "ambient_temperature_max_c": 32
  },
  "qa": [
    {
      "q": "What is the capacity?",
      "a": "46 litres, holds 38 standard 375ml cans.",
      "facts": [
        "capacity_litres",
        "capacity_375ml_cans"
      ]
    },
    {
      "q": "Is it lockable?",
      "a": "Yes. Includes a key lock.",
      "facts": [
        "lockable"
      ]
    },
    {
      "q": "How noisy is it?",
      "a": "39 dB.",
      "facts": [
        "noise_db"
      ]
    },
    {
      "q": "What are the running costs?",
      "a": "Power consumption is 0.21 kWh per 24 hours.",
      "facts": [
        "power_consumption_kwh_per_24h"
      ]
    }
  ],
  "documents": [
    {
      "type": "brochure",
      "url": "https://brochures.barfridgesaustralia.au/174752036/8850386420004.pdf",
      "source": "bar-fridges-australia.com.au",
      "brand_certified": false
    }
  ],
  "sellers": [
    {
      "name": "Bar Fridges Australia",
      "domain": "bar-fridges-australia.com.au",
      "url": "https://bar-fridges-australia.com.au/products/vodka-cruiser-retro-mini-bar-fridge-46-litre-with-opener",
      "authorized": false,
      "regions": [
        "AU"
      ]
    }
  ],
  "manufacturer": "Schmick",
  "branding": {
    "type": "licensed_wrap",
    "wrap_brand": "Victoria Cross",
    "licensor": "CUB"
  },
  "base_model": "BC46W"
}
