{
  "schema": "pir/1.0",
  "gtin": "9351886003854",
  "sku": "BC70B-ROADIE-AUS",
  "brand": "Schmick",
  "range": "BC",
  "name": "1-Door Bar Fridge",
  "category": "bar_fridge",
  "status": {
    "brand_certified": false,
    "brand_domain": null,
    "certified_date": null,
    "submitted_by": "bar-fridges-australia.com.au",
    "submitted_date": "2026-03-05"
  },
  "facts": {
    "capacity_litres": 70,
    "capacity_375ml_cans": 85,
    "dimensions_exterior_w_mm": 430,
    "dimensions_exterior_d_mm": 475,
    "dimensions_exterior_h_mm": 690,
    "weight_kg": 21,
    "noise_db": 39,
    "power_consumption_kwh_per_24h": 0.5,
    "location": [
      "indoor"
    ],
    "lockable": true,
    "adjustable_feet": true,
    "adjustable_feet_count": 2,
    "door_hinge": "right",
    "glass_door": true,
    "led_lighting": true,
    "body_material": "Black",
    "interior_finish": "Black Molded Plastic",
    "grill_material": "Black",
    "running_cost_aud_annual": 46.79,
    "running_cost_basis_cents_per_kwh": 25.64,
    "energy_star_rating_au": 10,
    "dimensions_interior_w_mm": 350,
    "dimensions_interior_d_mm": 300,
    "dimensions_interior_h_mm": 595,
    "ventilation_top_mm": 20,
    "ventilation_each_side_mm": 20,
    "ventilation_rear_mm": 100,
    "approvals": [
      "EMC (C-Tick)",
      "SAA Electrical",
      "Meps"
    ],
    "refrigerant": "R600",
    "shelf_type": "2 x Large and 1 x Half Shelf",
    "energy_star_rating_au_note": "Australian 1-10 star scale",
    "door_reversible": false,
    "door_count": 1
  },
  "qa": [
    {
      "q": "What is the capacity?",
      "a": "70 litres, holds 85 standard 375ml cans.",
      "facts": [
        "capacity_litres",
        "capacity_375ml_cans"
      ]
    },
    {
      "q": "Is it lockable?",
      "a": "Yes. Includes a key lock.",
      "facts": [
        "lockable"
      ]
    },
    {
      "q": "How noisy is it?",
      "a": "39 dB.",
      "facts": [
        "noise_db"
      ]
    },
    {
      "q": "What are the running costs?",
      "a": "Approximately $46.79 AUD per year based on 25.64 cents per kWh.",
      "facts": [
        "running_cost_aud_annual",
        "running_cost_basis_cents_per_kwh",
        "power_consumption_kwh_per_24h"
      ]
    },
    {
      "q": "What refrigerant does it use?",
      "a": "R600.",
      "facts": [
        "refrigerant"
      ]
    },
    {
      "q": "What is the energy star rating?",
      "a": "10 stars on the Australian 1-10 star scale.",
      "facts": [
        "energy_star_rating_au",
        "energy_star_rating_au_note"
      ]
    },
    {
      "q": "What approvals does it have?",
      "a": "EMC (C-Tick), SAA Electrical, Meps.",
      "facts": [
        "approvals"
      ]
    }
  ],
  "documents": [
    {
      "type": "brochure",
      "url": "https://brochures.barfridgesaustralia.au/174752036/8393332392228.pdf",
      "source": "bar-fridges-australia.com.au",
      "brand_certified": false
    }
  ],
  "sellers": [
    {
      "name": "Bar Fridges Australia",
      "domain": "bar-fridges-australia.com.au",
      "url": "https://bar-fridges-australia.com.au/products/music-roadie-case-retro-mini-bar-fridge-70-litre-schmick-brand-with-opener",
      "authorized": false,
      "regions": [
        "AU"
      ]
    }
  ]
}
