{
  "schema": "pir/1.0",
  "gtin": "9351886000884",
  "sku": "HUS-SC88-SS",
  "brand": "Schmick",
  "range": "HUS",
  "name": "1-Door Outdoor Bar Fridge (Triple Glazed)",
  "category": "bar_fridge",
  "status": {
    "brand_certified": false,
    "brand_domain": null,
    "certified_date": null,
    "submitted_by": "bar-fridges-australia.com.au",
    "submitted_date": "2026-03-05"
  },
  "facts": {
    "capacity_litres": 98,
    "capacity_375ml_cans": 115,
    "dimensions_exterior_w_mm": 470,
    "dimensions_exterior_d_mm": 500,
    "dimensions_exterior_h_mm": 850,
    "weight_kg": 32,
    "noise_db": 41,
    "power_consumption_kwh_per_24h": 1.7,
    "ambient_temperature_max_c": 38,
    "location": [
      "indoor",
      "outdoor"
    ],
    "lockable": true,
    "adjustable_feet": true,
    "adjustable_feet_count": 4,
    "door_hinge": "right",
    "led_lighting": true,
    "interior_finish": "Black Molded Plastic",
    "running_cost_aud_annual": 159.1,
    "running_cost_basis_cents_per_kwh": 25.64,
    "energy_star_rating_au": 10,
    "dimensions_interior_w_mm": 375,
    "dimensions_interior_d_mm": 355,
    "dimensions_interior_h_mm": 730,
    "ventilation_top_mm": 30,
    "ventilation_each_side_mm": 30,
    "ventilation_rear_mm": 100,
    "approvals": [
      "Meps",
      "SAA Electrical",
      "EMC (C-Tick)"
    ],
    "refrigerant": "R600",
    "shelf_type": "4 x flat chromed adjustable shelves (3 x 390mmW x 340mmD) and (1 x 390mmW x 215mmD)",
    "component_fan_secondary": "Noctua (Silent)",
    "energy_star_rating_au_note": "Australian 1-10 star scale",
    "door_type": "glass",
    "door_reversible": false,
    "door_count": 1,
    "door_heated": false,
    "body_colour": "black",
    "led_light_colour": "white"
  },
  "qa": [
    {
      "q": "What is the capacity?",
      "a": "98 litres, holds 115 standard 375ml cans.",
      "facts": [
        "capacity_litres",
        "capacity_375ml_cans"
      ]
    },
    {
      "q": "Is it lockable?",
      "a": "Yes. Includes a key lock.",
      "facts": [
        "lockable"
      ]
    },
    {
      "q": "How noisy is it?",
      "a": "41 dB.",
      "facts": [
        "noise_db"
      ]
    },
    {
      "q": "What are the running costs?",
      "a": "Approximately $159.10 AUD per year based on 25.64 cents per kWh.",
      "facts": [
        "running_cost_aud_annual",
        "running_cost_basis_cents_per_kwh",
        "power_consumption_kwh_per_24h"
      ]
    },
    {
      "q": "What refrigerant does it use?",
      "a": "R600.",
      "facts": [
        "refrigerant"
      ]
    },
    {
      "q": "What is the energy star rating?",
      "a": "10 stars on the Australian 1-10 star scale.",
      "facts": [
        "energy_star_rating_au",
        "energy_star_rating_au_note"
      ]
    },
    {
      "q": "What approvals does it have?",
      "a": "Meps, SAA Electrical, EMC (C-Tick).",
      "facts": [
        "approvals"
      ]
    }
  ],
  "documents": [
    {
      "type": "brochure",
      "url": "https://brochures.barfridgesaustralia.au/174752036/8392881701156.pdf",
      "source": "bar-fridges-australia.com.au",
      "brand_certified": false
    }
  ],
  "sellers": [
    {
      "name": "Bar Fridges Australia",
      "domain": "bar-fridges-australia.com.au",
      "url": "https://bar-fridges-australia.com.au/products/schmick-outdoor-triple-glazed-alfresco-bar-fridge-with-led-strip-lights-lock-and-low-e-glass-indoor-use-also-perfect",
      "authorized": false,
      "regions": [
        "AU"
      ]
    }
  ]
}
