{
  "schema": "pir/1.0",
  "gtin": "9351886005889",
  "sku": "RF-42-VB-V1",
  "brand": "Schmick",
  "range": "RF",
  "name": "1-Door Portable Fridge",
  "category": "portable_fridge",
  "status": {
    "brand_certified": false,
    "brand_domain": null,
    "certified_date": null,
    "submitted_by": "bar-fridges-australia.com.au",
    "submitted_date": "2026-03-05"
  },
  "facts": {
    "capacity_litres": 42,
    "capacity_375ml_cans": 62,
    "dimensions_exterior_w_mm": 520,
    "dimensions_exterior_d_mm": 370,
    "dimensions_exterior_h_mm": 785,
    "weight_kg": 32,
    "noise_db": 43,
    "power_consumption_kwh_per_24h": 0.9,
    "ambient_temperature_max_c": 32,
    "location": [
      "indoor"
    ],
    "lockable": true,
    "adjustable_feet": true,
    "adjustable_feet_count": 4,
    "door_hinge": "right",
    "glass_door": true,
    "led_lighting": true,
    "body_material": "Branded",
    "interior_finish": "White Molded Plastic",
    "grill_material": "Branded",
    "door_reversible": true,
    "door_count": 1
  },
  "qa": [
    {
      "q": "What is the capacity?",
      "a": "42 litres, holds 62 standard 375ml cans.",
      "facts": [
        "capacity_litres",
        "capacity_375ml_cans"
      ]
    },
    {
      "q": "Is it lockable?",
      "a": "Yes. Includes a key lock.",
      "facts": [
        "lockable"
      ]
    },
    {
      "q": "How noisy is it?",
      "a": "43 dB.",
      "facts": [
        "noise_db"
      ]
    },
    {
      "q": "What are the running costs?",
      "a": "Power consumption is 0.9 kWh per 24 hours.",
      "facts": [
        "power_consumption_kwh_per_24h"
      ]
    }
  ],
  "documents": [
    {
      "type": "brochure",
      "url": "https://brochures.barfridgesaustralia.au/174752036/8396994674980.pdf",
      "source": "bar-fridges-australia.com.au",
      "brand_certified": false
    }
  ],
  "sellers": [
    {
      "name": "Bar Fridges Australia",
      "domain": "bar-fridges-australia.com.au",
      "url": "https://bar-fridges-australia.com.au/products/round-shaped-vb-bar-fridge-with-blue-tooth-and-speakers-makes-a-great-gift-idea-model-rf-42-vb-v1",
      "authorized": false,
      "regions": [
        "AU"
      ]
    }
  ],
  "manufacturer": "Schmick",
  "branding": {
    "type": "licensed_wrap",
    "wrap_brand": "Victoria Bitter",
    "licensor": "CUB"
  },
  "base_model": "RF-42"
}
