{
  "schema": "pir/1.0",
  "gtin": "9351886003113",
  "sku": "SK168B",
  "brand": "Schmick",
  "range": "SK",
  "name": "1-Door Upright Fridge",
  "category": "bar_fridge",
  "status": {
    "brand_certified": false,
    "brand_domain": null,
    "certified_date": null,
    "submitted_by": "bar-fridges-australia.com.au",
    "submitted_date": "2026-03-05"
  },
  "facts": {
    "capacity_litres": 213,
    "capacity_375ml_cans": 255,
    "dimensions_exterior_w_mm": 595,
    "dimensions_exterior_d_mm": 395,
    "dimensions_exterior_h_mm": 1820,
    "weight_kg": 92,
    "noise_db": 43,
    "power_consumption_kwh_per_24h": 4.6,
    "ambient_temperature_max_c": 38,
    "location": [
      "indoor",
      "outdoor"
    ],
    "lockable": true,
    "adjustable_feet": true,
    "adjustable_feet_count": 4,
    "door_hinge": "left",
    "glass_door": true,
    "led_lighting": true,
    "body_material": "Black",
    "interior_finish": "Molded Black",
    "grill_material": "Black",
    "glass_door_type": "Triple glazed tempered LOW E glass",
    "running_cost_aud_annual": 430.5,
    "running_cost_basis_cents_per_kwh": 25.64,
    "dimensions_interior_w_mm": 515,
    "dimensions_interior_d_mm": 255,
    "dimensions_interior_h_mm": 1575,
    "ventilation_top_mm": 20,
    "ventilation_each_side_mm": 20,
    "ventilation_rear_mm": 20,
    "approvals": [
      "Meps",
      "RCM"
    ],
    "refrigerant": "R600"
  },
  "qa": [
    {
      "q": "What is the capacity?",
      "a": "213 litres, holds 255 standard 375ml cans.",
      "facts": [
        "capacity_litres",
        "capacity_375ml_cans"
      ]
    },
    {
      "q": "Is it lockable?",
      "a": "Yes. Includes a key lock.",
      "facts": [
        "lockable"
      ]
    },
    {
      "q": "How noisy is it?",
      "a": "43 dB.",
      "facts": [
        "noise_db"
      ]
    },
    {
      "q": "What are the running costs?",
      "a": "Approximately $430.50 AUD per year based on 25.64 cents per kWh.",
      "facts": [
        "running_cost_aud_annual",
        "running_cost_basis_cents_per_kwh",
        "power_consumption_kwh_per_24h"
      ]
    },
    {
      "q": "What refrigerant does it use?",
      "a": "R600.",
      "facts": [
        "refrigerant"
      ]
    },
    {
      "q": "What approvals does it have?",
      "a": "Meps, RCM.",
      "facts": [
        "approvals"
      ]
    }
  ],
  "documents": [
    {
      "type": "brochure",
      "url": "https://brochures.barfridgesaustralia.au/174752036/8393824960804.pdf",
      "source": "bar-fridges-australia.com.au",
      "brand_certified": false
    }
  ],
  "sellers": [
    {
      "name": "Bar Fridges Australia",
      "domain": "bar-fridges-australia.com.au",
      "url": "https://bar-fridges-australia.com.au/products/upright-super-slim-depth-quiet-running-glass-front-beer-fridge-with-5-x-led-colour-options",
      "authorized": false,
      "regions": [
        "AU"
      ]
    }
  ]
}
