{
  "schema": "pir/1.0",
  "gtin": "9351886008446",
  "sku": "PG65A-CCR",
  "brand": "Coca Cola",
  "range": "PG",
  "name": "1-Door Bar Fridge",
  "category": "bar_fridge",
  "status": {
    "brand_certified": false,
    "brand_domain": null,
    "certified_date": null,
    "submitted_by": "bar-fridges-australia.com.au",
    "submitted_date": "2026-03-05"
  },
  "facts": {
    "capacity_litres": 65,
    "capacity_375ml_cans": 110,
    "dimensions_exterior_w_mm": 445,
    "dimensions_exterior_d_mm": 445,
    "dimensions_exterior_h_mm": 960,
    "weight_kg": 22,
    "noise_db": 41,
    "power_consumption_kwh_per_24h": 1.5,
    "ambient_temperature_max_c": 32,
    "location": [
      "indoor",
      "outdoor"
    ],
    "lockable": true,
    "adjustable_feet": true,
    "adjustable_feet_count": 0,
    "door_hinge": "right",
    "glass_door": true,
    "led_lighting": true,
    "body_material": "Coca-Cola branded",
    "interior_finish": "Black Molded Plastic",
    "grill_material": "Black"
  },
  "qa": [
    {
      "q": "What is the capacity?",
      "a": "65 litres, holds 110 standard 375ml cans.",
      "facts": [
        "capacity_litres",
        "capacity_375ml_cans"
      ]
    },
    {
      "q": "Is it lockable?",
      "a": "Yes. Includes a key lock.",
      "facts": [
        "lockable"
      ]
    },
    {
      "q": "How noisy is it?",
      "a": "41 dB.",
      "facts": [
        "noise_db"
      ]
    },
    {
      "q": "What are the running costs?",
      "a": "Power consumption is 1.5 kWh per 24 hours.",
      "facts": [
        "power_consumption_kwh_per_24h"
      ]
    }
  ],
  "documents": [
    {
      "type": "brochure",
      "url": "https://brochures.barfridgesaustralia.au/174752036/10283415535908.pdf",
      "source": "bar-fridges-australia.com.au",
      "brand_certified": false
    }
  ],
  "sellers": [
    {
      "name": "Bar Fridges Australia",
      "domain": "bar-fridges-australia.com.au",
      "url": "https://bar-fridges-australia.com.au/products/official-coca-cola-branded-schmick-can-cooler-barrel-fridges-model-pg-65a-cc",
      "authorized": false,
      "regions": [
        "AU"
      ]
    }
  ]
}
