{
  "schema": "pir/1.0",
  "gtin": "9351886007005",
  "sku": "SS-P160-PERONI-V2",
  "brand": "Schmick",
  "range": "SS",
  "name": "1-Door Bar Fridge",
  "category": "bar_fridge",
  "status": {
    "brand_certified": false,
    "brand_domain": null,
    "certified_date": null,
    "submitted_by": "bar-fridges-australia.com.au",
    "submitted_date": "2026-03-05"
  },
  "facts": {
    "capacity_litres": 160,
    "capacity_375ml_cans": 144,
    "dimensions_exterior_w_mm": 390,
    "dimensions_exterior_d_mm": 475,
    "dimensions_exterior_h_mm": 1880,
    "weight_kg": 60,
    "noise_db": 43,
    "power_consumption_kwh_per_24h": 2.1,
    "ambient_temperature_max_c": 38,
    "location": [
      "indoor",
      "outdoor"
    ],
    "lockable": true,
    "adjustable_feet": true,
    "adjustable_feet_count": 4,
    "door_hinge": "right",
    "led_lighting": true,
    "interior_finish": "Smashed Aluminum",
    "door_reversible": true,
    "door_count": 1,
    "door_type": "glass",
    "door_heated": false,
    "body_colour": "branded",
    "led_light_colour": "white"
  },
  "qa": [
    {
      "q": "What is the capacity?",
      "a": "160 litres, holds 144 standard 375ml cans.",
      "facts": [
        "capacity_litres",
        "capacity_375ml_cans"
      ]
    },
    {
      "q": "Is it lockable?",
      "a": "Yes. Includes a key lock.",
      "facts": [
        "lockable"
      ]
    },
    {
      "q": "How noisy is it?",
      "a": "43 dB.",
      "facts": [
        "noise_db"
      ]
    },
    {
      "q": "What are the running costs?",
      "a": "Power consumption is 2.1 kWh per 24 hours.",
      "facts": [
        "power_consumption_kwh_per_24h"
      ]
    }
  ],
  "documents": [
    {
      "type": "brochure",
      "url": "https://brochures.barfridgesaustralia.au/174752036/9153214021924.pdf",
      "source": "bar-fridges-australia.com.au",
      "brand_certified": false
    }
  ],
  "sellers": [
    {
      "name": "Bar Fridges Australia",
      "domain": "bar-fridges-australia.com.au",
      "url": "https://bar-fridges-australia.com.au/products/peroni-branded-skinny-upright-bar-fridge-model-ss-p160-peroni-v2",
      "authorized": false,
      "regions": [
        "AU"
      ]
    }
  ],
  "manufacturer": "Schmick",
  "branding": {
    "type": "licensed_wrap",
    "wrap_brand": "Peroni",
    "licensor": "Asahi"
  },
  "base_model": "SS-P160"
}
