{
  "schema": "pir/1.0",
  "gtin": "9351886000174",
  "sku": "DW60E",
  "brand": "Dellware",
  "range": "Other",
  "name": "1-Door Bar Fridge",
  "category": "bar_fridge",
  "status": {
    "brand_certified": false,
    "brand_domain": null,
    "certified_date": null,
    "submitted_by": "bar-fridges-australia.com.au",
    "submitted_date": "2026-03-05"
  },
  "facts": {
    "capacity_litres": 60,
    "capacity_375ml_cans": 60,
    "dimensions_exterior_w_mm": 460,
    "dimensions_exterior_d_mm": 495,
    "dimensions_exterior_h_mm": 605,
    "weight_kg": 18,
    "noise_db": 12,
    "power_consumption_kwh_per_24h": 0.65,
    "ambient_temperature_max_c": 25,
    "location": [
      "indoor"
    ],
    "lockable": true,
    "adjustable_feet": true,
    "adjustable_feet_count": 2,
    "door_hinge": "1 x left, 1 x right",
    "glass_door": true,
    "led_lighting": true,
    "body_material": "Black",
    "grill_material": "Black"
  },
  "qa": [
    {
      "q": "What is the capacity?",
      "a": "60 litres, holds 60 standard 375ml cans.",
      "facts": [
        "capacity_litres",
        "capacity_375ml_cans"
      ]
    },
    {
      "q": "Is it lockable?",
      "a": "Yes. Includes a key lock.",
      "facts": [
        "lockable"
      ]
    },
    {
      "q": "How noisy is it?",
      "a": "12 dB.",
      "facts": [
        "noise_db"
      ]
    },
    {
      "q": "What are the running costs?",
      "a": "Power consumption is 0.65 kWh per 24 hours.",
      "facts": [
        "power_consumption_kwh_per_24h"
      ]
    }
  ],
  "documents": [
    {
      "type": "brochure",
      "url": "https://brochures.barfridgesaustralia.au/174752036/8392950710564.pdf",
      "source": "bar-fridges-australia.com.au",
      "brand_certified": false
    }
  ],
  "sellers": [
    {
      "name": "Bar Fridges Australia",
      "domain": "bar-fridges-australia.com.au",
      "url": "https://bar-fridges-australia.com.au/products/silent-60-litre-motel-quiet-mini-bar-fridge-with-solid-door",
      "authorized": false,
      "regions": [
        "AU"
      ]
    }
  ],
  "manufacturer": "Schmick",
  "branding": {
    "type": "oem",
    "original_brand": "Dellware"
  }
}
