{
  "schema": "pir/1.0",
  "gtin": "9351886000242",
  "sku": "EC68L-SSH",
  "brand": "Schmick",
  "range": "EC",
  "name": "1-Door Bar Fridge",
  "category": "bar_fridge",
  "status": {
    "brand_certified": false,
    "brand_domain": null,
    "certified_date": null,
    "submitted_by": "bar-fridges-australia.com.au",
    "submitted_date": "2026-03-05"
  },
  "facts": {
    "capacity_litres": 70,
    "capacity_375ml_cans": 80,
    "dimensions_exterior_w_mm": 430,
    "dimensions_exterior_d_mm": 500,
    "dimensions_exterior_h_mm": 700,
    "weight_kg": 26,
    "noise_db": 43,
    "power_consumption_kwh_per_24h": 0.69,
    "ambient_temperature_max_c": 38,
    "location": [
      "indoor",
      "outdoor"
    ],
    "lockable": true,
    "adjustable_feet": true,
    "adjustable_feet_count": 4,
    "door_hinge": "Left Hinged",
    "glass_door": true,
    "led_lighting": true,
    "body_material": "Black",
    "grill_material": "Stainless Steel",
    "glass_door_type": "Dual glazed tempered LOW E glass",
    "running_cost_aud_annual": 64.57,
    "running_cost_basis_cents_per_kwh": 25.64,
    "dimensions_interior_w_mm": 360,
    "dimensions_interior_d_mm": 360,
    "dimensions_interior_h_mm": 595,
    "ventilation_top_mm": 20,
    "ventilation_each_side_mm": 20,
    "ventilation_rear_mm": 100,
    "approvals": [
      "EMC (C-Tick)",
      "SAA Electrical",
      "Meps"
    ],
    "refrigerant": "R600",
    "shelf_type": "3 x chromed shelves (340mm x 340mm)"
  },
  "qa": [
    {
      "q": "What is the capacity?",
      "a": "70 litres, holds 80 standard 375ml cans.",
      "facts": [
        "capacity_litres",
        "capacity_375ml_cans"
      ]
    },
    {
      "q": "Is it lockable?",
      "a": "Yes. Includes a key lock.",
      "facts": [
        "lockable"
      ]
    },
    {
      "q": "How noisy is it?",
      "a": "43 dB.",
      "facts": [
        "noise_db"
      ]
    },
    {
      "q": "What are the running costs?",
      "a": "Approximately $64.57 AUD per year based on 25.64 cents per kWh.",
      "facts": [
        "running_cost_aud_annual",
        "running_cost_basis_cents_per_kwh",
        "power_consumption_kwh_per_24h"
      ]
    },
    {
      "q": "What refrigerant does it use?",
      "a": "R600.",
      "facts": [
        "refrigerant"
      ]
    },
    {
      "q": "What approvals does it have?",
      "a": "EMC (C-Tick), SAA Electrical, Meps.",
      "facts": [
        "approvals"
      ]
    }
  ],
  "documents": [
    {
      "type": "brochure",
      "url": "https://brochures.barfridgesaustralia.au/174752036/8392769339684.pdf",
      "source": "bar-fridges-australia.com.au",
      "brand_certified": false
    }
  ],
  "sellers": [
    {
      "name": "Bar Fridges Australia",
      "domain": "bar-fridges-australia.com.au",
      "url": "https://bar-fridges-australia.com.au/products/tropical-glass-door-mini-bar-fridge-80-cans-left-hinged",
      "authorized": false,
      "regions": [
        "AU"
      ]
    }
  ]
}
