{
  "schema": "pir/1.0",
  "gtin": "9351886004141",
  "sku": "SC70-SS-GNBC-GOLD",
  "brand": "Schmick",
  "range": "SC",
  "name": "1-Door Bar Fridge",
  "category": "bar_fridge",
  "status": {
    "brand_certified": false,
    "brand_domain": null,
    "certified_date": null,
    "submitted_by": "bar-fridges-australia.com.au",
    "submitted_date": "2026-03-05"
  },
  "facts": {
    "capacity_litres": 70,
    "capacity_375ml_cans": 85,
    "dimensions_exterior_w_mm": 430,
    "dimensions_exterior_d_mm": 500,
    "dimensions_exterior_h_mm": 700,
    "weight_kg": 34,
    "noise_db": 43,
    "power_consumption_kwh_per_24h": 1.6,
    "ambient_temperature_max_c": 38,
    "location": [
      "indoor"
    ],
    "lockable": true,
    "adjustable_feet": true,
    "adjustable_feet_count": 2,
    "door_hinge": "right",
    "glass_door": true,
    "led_lighting": true,
    "interior_finish": "Black Molded Plastic",
    "door_reversible": true,
    "door_count": 1,
    "door_type": "glass",
    "door_heated": false,
    "body_colour": "branded",
    "led_light_colour": "white"
  },
  "qa": [
    {
      "q": "What is the capacity?",
      "a": "70 litres, holds 85 standard 375ml cans.",
      "facts": [
        "capacity_litres",
        "capacity_375ml_cans"
      ]
    },
    {
      "q": "Is it lockable?",
      "a": "Yes. Includes a key lock.",
      "facts": [
        "lockable"
      ]
    },
    {
      "q": "How noisy is it?",
      "a": "43 dB.",
      "facts": [
        "noise_db"
      ]
    },
    {
      "q": "What are the running costs?",
      "a": "Power consumption is 1.6 kWh per 24 hours.",
      "facts": [
        "power_consumption_kwh_per_24h"
      ]
    }
  ],
  "documents": [
    {
      "type": "brochure",
      "url": "https://brochures.barfridgesaustralia.au/174752036/8393519005988.pdf",
      "source": "bar-fridges-australia.com.au",
      "brand_certified": false
    }
  ],
  "sellers": [
    {
      "name": "Bar Fridges Australia",
      "domain": "bar-fridges-australia.com.au",
      "url": "https://bar-fridges-australia.com.au/products/great-northern-branded-bar-fridge-great-gift-idea-great-entertaining-room-or-man-cave-item",
      "authorized": false,
      "regions": [
        "AU"
      ]
    }
  ],
  "manufacturer": "Schmick",
  "branding": {
    "type": "licensed_wrap",
    "wrap_brand": "Great Northern Gold",
    "licensor": "CUB"
  },
  "base_model": "SC70"
}
