{
  "schema": "pir/1.0",
  "gtin": "9351886000372",
  "sku": "BC46B-RET",
  "brand": "Schmick",
  "range": "HUS",
  "name": "1-Door Bar Fridge",
  "category": "bar_fridge",
  "status": {
    "brand_certified": false,
    "brand_domain": null,
    "certified_date": null,
    "submitted_by": "bar-fridges-australia.com.au",
    "submitted_date": "2026-03-05"
  },
  "facts": {
    "capacity_litres": 46,
    "capacity_375ml_cans": 38,
    "dimensions_exterior_w_mm": 430,
    "dimensions_exterior_d_mm": 470,
    "dimensions_exterior_h_mm": 500,
    "weight_kg": 16,
    "noise_db": 39,
    "power_consumption_kwh_per_24h": 0.21,
    "ambient_temperature_max_c": 38.0,
    "location": [
      "indoor"
    ],
    "lockable": false,
    "adjustable_feet": true,
    "adjustable_feet_count": 2,
    "door_hinge": "right",
    "led_lighting": true,
    "interior_finish": "Black Molded Plastic",
    "running_cost_aud_annual": 19.65,
    "running_cost_basis_cents_per_kwh": 25.64,
    "dimensions_interior_w_mm": 350,
    "dimensions_interior_d_mm": 360,
    "dimensions_interior_h_mm": 415,
    "ventilation_top_mm": 20,
    "ventilation_each_side_mm": 20,
    "ventilation_rear_mm": 100,
    "approvals": [
      "Meps",
      "SAA Electrical",
      "EMC (C-Tick)"
    ],
    "refrigerant": "R600",
    "shelf_count": 2,
    "adjustable_shelf": true,
    "shelf_type": "1 x Large and 1 x Half Shelf",
    "door_reversible": false,
    "door_count": 1,
    "door_type": "glass",
    "door_heated": false,
    "body_colour": "black",
    "led_light_colour": "white"
  },
  "qa": [
    {
      "q": "What is the capacity?",
      "a": "46 litres, holds 38 standard 375ml cans.",
      "facts": [
        "capacity_litres",
        "capacity_375ml_cans"
      ]
    },
    {
      "q": "Is it lockable?",
      "a": "Yes. Includes a key lock.",
      "facts": [
        "lockable"
      ]
    },
    {
      "q": "How noisy is it?",
      "a": "39 dB.",
      "facts": [
        "noise_db"
      ]
    },
    {
      "q": "What are the running costs?",
      "a": "Approximately $19.65 AUD per year based on 25.64 cents per kWh.",
      "facts": [
        "running_cost_aud_annual",
        "running_cost_basis_cents_per_kwh",
        "power_consumption_kwh_per_24h"
      ]
    },
    {
      "q": "What refrigerant does it use?",
      "a": "R600.",
      "facts": [
        "refrigerant"
      ]
    },
    {
      "q": "What approvals does it have?",
      "a": "Meps, SAA Electrical, EMC (C-Tick).",
      "facts": [
        "approvals"
      ]
    }
  ],
  "documents": [
    {
      "type": "brochure",
      "url": "https://brochures.barfridgesaustralia.au/174752036/8392870101284.pdf",
      "source": "bar-fridges-australia.com.au",
      "brand_certified": false
    }
  ],
  "sellers": [
    {
      "name": "Bar Fridges Australia",
      "domain": "bar-fridges-australia.com.au",
      "url": "https://bar-fridges-australia.com.au/products/retro-black-small-vintage-mini-bar-fridge-46-litre-schmick-brand-with-opener",
      "authorized": false,
      "regions": [
        "AU"
      ]
    }
  ]
}
