{
  "schema": "pir/1.0",
  "gtin": "9351886000495",
  "sku": "HUS-EX108",
  "brand": "Schmick",
  "range": "HUS",
  "name": "1-Door Outdoor Bar Fridge",
  "category": "bar_fridge",
  "status": {
    "brand_certified": false,
    "brand_domain": null,
    "certified_date": null,
    "submitted_by": "bar-fridges-australia.com.au",
    "submitted_date": "2026-03-05"
  },
  "facts": {
    "capacity_litres": 108,
    "capacity_375ml_cans": 108,
    "dimensions_exterior_w_mm": 560,
    "dimensions_exterior_d_mm": 500,
    "dimensions_exterior_h_mm": 850,
    "weight_kg": 50,
    "noise_db": 45,
    "power_consumption_kwh_per_24h": 2.37,
    "ambient_temperature_max_c": 38,
    "location": [
      "indoor",
      "outdoor"
    ],
    "lockable": true,
    "adjustable_feet": true,
    "door_hinge": "Right Hinge (Handle Left)",
    "glass_door": true,
    "led_lighting": true,
    "body_material": "Black",
    "interior_finish": "Black Molded Plastic",
    "grill_material": "Black All Glass With Black Trim",
    "running_cost_aud_annual": 221.8,
    "running_cost_basis_cents_per_kwh": 25.64,
    "dimensions_interior_w_mm": 445,
    "dimensions_interior_d_mm": 360,
    "dimensions_interior_h_mm": 700,
    "ventilation_top_mm": 30,
    "ventilation_each_side_mm": 30,
    "ventilation_rear_mm": 100,
    "approvals": [
      "SAA Electrical",
      "EMC (C-Tick)"
    ],
    "refrigerant": "R600",
    "shelf_type": "3 x 2Pc Shelves (463mmW x 340mmD)",
    "glass_door_heated_switchable": true,
    "door_type": "heated_tempered"
  },
  "qa": [
    {
      "q": "What is the capacity?",
      "a": "108 litres, holds 108 standard 375ml cans.",
      "facts": [
        "capacity_litres",
        "capacity_375ml_cans"
      ]
    },
    {
      "q": "Is it lockable?",
      "a": "Yes. Includes a key lock.",
      "facts": [
        "lockable"
      ]
    },
    {
      "q": "How noisy is it?",
      "a": "45 dB.",
      "facts": [
        "noise_db"
      ]
    },
    {
      "q": "What are the running costs?",
      "a": "Approximately $221.80 AUD per year based on 25.64 cents per kWh.",
      "facts": [
        "running_cost_aud_annual",
        "running_cost_basis_cents_per_kwh",
        "power_consumption_kwh_per_24h"
      ]
    },
    {
      "q": "What refrigerant does it use?",
      "a": "R600.",
      "facts": [
        "refrigerant"
      ]
    },
    {
      "q": "What approvals does it have?",
      "a": "SAA Electrical, EMC (C-Tick).",
      "facts": [
        "approvals"
      ]
    }
  ],
  "documents": [
    {
      "type": "brochure",
      "url": "https://brochures.barfridgesaustralia.au/174752036/8392918761764.pdf",
      "source": "bar-fridges-australia.com.au",
      "brand_certified": false
    }
  ],
  "sellers": [
    {
      "name": "Bar Fridges Australia",
      "domain": "bar-fridges-australia.com.au",
      "url": "https://bar-fridges-australia.com.au/products/schmick-alfresco-under-zero-australias-coldest-beer-party-fridge-with-blast-chill-mode",
      "authorized": false,
      "regions": [
        "AU"
      ]
    }
  ]
}
