{
  "schema": "pir/1.0",
  "gtin": "9351886003595",
  "sku": "SK206-SS",
  "brand": "Schmick",
  "range": "SK",
  "name": "2-Door Bar Fridge (Triple Glazed)",
  "category": "bar_fridge",
  "status": {
    "brand_certified": false,
    "brand_domain": null,
    "certified_date": null,
    "submitted_by": "bar-fridges-australia.com.au",
    "submitted_date": "2026-03-05"
  },
  "facts": {
    "capacity_litres": 233,
    "capacity_375ml_cans": 264,
    "dimensions_exterior_w_mm": 895,
    "dimensions_exterior_d_mm": 575,
    "dimensions_exterior_h_mm": 800,
    "weight_kg": 80,
    "noise_db": 43,
    "power_consumption_kwh_per_24h": 2.09,
    "ambient_temperature_max_c": 38,
    "location": [
      "indoor",
      "outdoor"
    ],
    "lockable": true,
    "adjustable_feet": true,
    "adjustable_feet_count": 4,
    "door_hinge": "1 x left, 1 x right",
    "glass_door": true,
    "led_lighting": true,
    "body_material": "304 stainless steel",
    "interior_finish": "Polished Mirror Stainless Steel",
    "running_cost_aud_annual": 195.59,
    "running_cost_basis_cents_per_kwh": 25.64,
    "internal_temperature_min_c": 0,
    "dimensions_interior_w_mm": 815,
    "dimensions_interior_d_mm": 430,
    "dimensions_interior_h_mm": 655,
    "ventilation_top_mm": 10,
    "ventilation_each_side_mm": 10,
    "ventilation_rear_mm": 50,
    "approvals": [
      "GEMS 2022",
      "Meps",
      "EMC (C-Tick)",
      "SAA Electrical"
    ],
    "refrigerant": "R600",
    "component_compressor": "Jiaxipera",
    "component_transformer": "Meanwell (Taiwan)",
    "component_fan_primary": "Schmick quiet running fans",
    "component_controller": "Schmick ECO Controller",
    "door_type": "glass",
    "door_reversible": false,
    "door_count": 2,
    "door_heated": false,
    "body_colour": "stainless steel",
    "led_light_colour": "white"
  },
  "qa": [
    {
      "q": "What is the capacity?",
      "a": "233 litres, holds 264 standard 375ml cans.",
      "facts": [
        "capacity_litres",
        "capacity_375ml_cans"
      ]
    },
    {
      "q": "Is it lockable?",
      "a": "Yes. Includes a key lock.",
      "facts": [
        "lockable"
      ]
    },
    {
      "q": "How noisy is it?",
      "a": "43 dB.",
      "facts": [
        "noise_db"
      ]
    },
    {
      "q": "What are the running costs?",
      "a": "Approximately $195.59 AUD per year based on 25.64 cents per kWh.",
      "facts": [
        "running_cost_aud_annual",
        "running_cost_basis_cents_per_kwh",
        "power_consumption_kwh_per_24h"
      ]
    },
    {
      "q": "What refrigerant does it use?",
      "a": "R600.",
      "facts": [
        "refrigerant"
      ]
    },
    {
      "q": "What approvals does it have?",
      "a": "GEMS 2022, Meps, EMC (C-Tick), SAA Electrical.",
      "facts": [
        "approvals"
      ]
    }
  ],
  "documents": [
    {
      "type": "brochure",
      "url": "https://brochures.barfridgesaustralia.au/174752036/8395638145316.pdf",
      "source": "bar-fridges-australia.com.au",
      "brand_certified": false
    }
  ],
  "sellers": [
    {
      "name": "Bar Fridges Australia",
      "domain": "bar-fridges-australia.com.au",
      "url": "https://bar-fridges-australia.com.au/products/schmick-twin-door-quiet-running-stainless-steel-triple-glazed-glass-door-bar-fridge-model-sk206-ss-low-height",
      "authorized": false,
      "regions": [
        "AU"
      ]
    }
  ]
}
